id;name;price;rate;sold;tags;
185;Мужская футболка ReFire Gear с длинными рукавами на молнии, цвета в ассортименте, размеры S-5XL;1653;4.7;2042;;
204;Футболка мужская с круглым вырезом однотонная, хлопок, размеры и цвета в ассортименте;1014;4.9;1756;top;
325;Футболка унисекс с коротким рукавом, цвет в ассортименте;1659;4.6;462;;
248;Футболка спортивная, размер S - 4XL, полиэстер, цвет в ассортименте;470;4.5;518;;
449;Качественная мужская футболка из 100% хлопка, Модная приталенная однотонная мужская футболка с коротким рукавом, футболка в бразильском стиле;898;4.8;312;;
619;Мужская футболка в готическом стиле;1222;4.7;294;;
514;Мужская футболка с принтом Hunter Killua Zoldyck;378;4.5;294;;
441;Мужская и женская футболка с принтом;925;4.7;316;;
547;Футболка мужская оверсайз из хлопка;880;5.0;303;;
419;Футболка унисекс, цвет в ассортименте;856;4.2;402;;
127;Мужская футболка COOLMIND;811;4.8;3045;top;
404;Мужская футболка из хлопка, с коротким рукавом;1442;4.9;417;top;
458;MEGE брендовая Тактическая Военная одежда мужская рубашка Прямая поставка однотонная быстросохнущая Мужская футболка Coolmax с длинным рукавом армейская Повседневная мужская футболка;1187;4.7;311;;
444;Футболка Ulzzang Graphic мужская;448;4.3;313;top;
225;Футболка мужская бамбуковая;1654;4.9;537;;
344;Мужская футболка с коротким рукавом и круглым вырезом;767;4.6;453;;
55;Новинка 2019, Мужская модная дизайнерская футболка с коротким рукавом и черепаховым принтом, смешные футболки в стиле Харадзюку, хипстерские крутые топы с круглым вырезом;751;5.0;162;;
221;Льняная мужская рубашка с длинным рукавом;1172;4.7;1637;;
131;Футболка унисекс Harajuku;1682;4.9;2853;top;
561;Свитшот с коротким рукавом GONTHWID из хлопка;1620;4.7;293;;
424;Мужская футболка с коротким рукавом;769;4.8;320;;
481;Мужская футболка с 3D-принтом;438;4.1;303;;
587;Футболка мужская оверсайз из хлопка;880;5.0;303;;
426;Мужские футболки с коротким рукавом;807;4.6;320;;
102;Футболка с вашим индивидуальным дизайном;738;4.7;156;;
433;Футболка мужская CHAMPRINT с круглым вырезом и короткими рукавами, черный, белый, бежевый, принты в ассортименте, размеры S-6XL;578;4.7;320;;
388;Футболка с принтом медведя KYKU;284;4.8;427;;
601;Свитшот с коротким рукавом GONTHWID из хлопка;1620;4.7;293;;
296;Мужская футболка с коротким рукавом и круглым вырезом;760;4.0;478;;
269;Мужская спортивная футболка с коротким рукавом;1091;4.5;498;top;
496;Футболка мужская с 3D-принтом СССР;261;4.6;300;;
446;Футболка мужская хлопковая с коротким рукавом;714;4.8;312;;
114;Футболка мужская летняя однотонная с V-образным вырезом и коротким рукавом;1045;4.6;155;;
181;Новинка 2023, Мужская футболка MRMT из 100% хлопка, однотонная мужская футболка с круглым вырезом и коротким рукавом, футболки для мужчин;769;4.8;2084;;
452;Футболка с принтом аниме «атака на Титанов», с коротким рукавом, в стиле Харадзюку;755;4.9;311;;
495;Футболка с принтом Kuakuayu HJN;1040;4.3;300;;
483;Футболка мужская оверсайз с принтом;919;4.8;303;;
375;"Мужская/детская хлопковая футболка ""Король и Шут"", размеры и цвета в ассортименте";909;4.8;436;top;
316;Футболка мужская Manto;973;4.7;466;;
153;Мужская хлопковая футболка с коротким рукавом;1712;4.9;2415;top;
173;Футболка для мужчин и женщин спортивная, размер 2XS - 5XL, цвет в ассортименте;261;4.4;2191;;
235;Мужская футболка с 3D-принтом корабля, цвет и размер в ассортименте;217;4.6;531;;
308;Мужская футболка с коротким рукавом;812;4.3;472;;
459;Мужская футболка с круглым вырезом, коротким рукавом и 3D-принтом;446;4.5;309;;
166;Мужские спортивные футболки jeansian LSL069;1250;4.2;2277;;
319;Мужская футболка BINYUXD с круглым вырезом;769;5.0;464;;
138;Мужская футболка/ мужской свитшот в полоску, оверсайз, размеры S-2XL, расцветки в ассортименте;569;4.7;2624;;
412;Мужская футболка с принтом игры World of Tanks;472;4.8;408;;
199;Мужская футболка 2024, летняя облегающая футболка с капюшоном с коротким рукавом для фитнеса, Мужская футболка, мужская спортивная футболка, тонкая футболка для мужчин 5XL;956;4.5;1833;;
567;Футболка мужская оверсайз из хлопка;880;5.0;303;;
260;Мужская льняная рубашка;459;4.2;511;;
234;Футболка мужская/женская оверсайз с 3D-принтом кота;768;4.4;526;;
117;Новая компрессионная рубашка для мужчин, футболка с коротким рукавом для фитнеса и бега, Мужская футболка для тренажерного зала, спортивная одежда, трико, футболка для мужчин;889;4.6;155;top;
122;Мужская футболка E-BAIHUI;1063;4.1;3118;;
465;BROWON 2024 Новая повседневная полосатая футболка для мужчин с длинным рукавом для фитнеса Мужская футболка одежда Camisetas Мужская футболка размера плюс;1316;4.9;308;;
509;Мужская футболка с длинными рукавами в свободном стиле, цвета и принты в ассортименте, размеры S-5XL;664;4.4;296;;
378;Хлопковая футболка с принтом Sicko Born From Pain;718;4.6;434;;
386;Мужская футболка Jeansian с длинным рукавом и защитой от солнца;1443;4.7;428;;
226;Футболка мужская с объемным рисунком;217;4.4;541;;
588;Мужская летняя футболка с 3D-принтом;293;4.6;296;;
490;Мужская хлопковая футболка с коротким рукавом;1907;4.8;302;top;
349;Мужская футболка с принтом аниме «Моя геройская академия», полиэстер;464;4.6;450;top;
129;Футболка мужская с коротким рукавом и принтом ночного воина;813;5.0;2943;;
611;Футболка мужская однотонная с длинным рукавом;1601;4.8;295;;
447;Мужская футболка с круглым вырезом и коротким рукавом;2054;4.7;312;;
287;BOLUBAO брендовая мужская повседневная футболка с круглым вырезом, одноцветная Мужская футболка, облегающая хлопковая футболка с коротким рукавом, Топы И Футболки унисекс;1090;4.9;487;;
572;Мужская однотонная рубашка с коротким рукавом из хлопка и льна, цвета в ассортименте;365;4.4;295;top;
45;Мужская футболка в стиле хип-хоп;2165;4.8;163;top;
109;Футболка с изображением Иисуса Христа;1690;4.4;156;;
524;Мужская футболка с капюшоном;811;4.6;298;;
558;Мужская футболка с коротким рукавом;1105;4.6;294;top;
135;Футболка мужская с длинным рукавом, хлопок, приталенный силуэт, V-образный вырез, топ в стиле хип-хоп, повседневная одежда, 5XL, весна;1025;4.1;2780;;
442;Хлопковая модная удлиненная Мужская футболка с длинным рукавом, уличная одежда, футболка в стиле хип-хоп, топы в стиле панк с коротким рукавом, свободная повседневная футболка TX145 RC;459;4.7;318;;
63;Мужская футболка с коротким рукавом Jeansian;1250;4.6;162;;
46;Мужская футболка в винтажном стиле;883;4.6;163;;
171;Футболка мужская оверсайз из чесаного хлопка;904;4.7;2245;;
67;Мужская футболка 3D Sasha Grey LOVE;1025;4.9;161;top;
285;Спортивная футболка с коротким рукавом, цвет в ассортименте;214;4.7;488;top;
87;Мужская футболка с коротким рукавом;970;4.5;158;;
244;Футболка с принтом специй для девочек, винтажная хлопковая рубашка с круглым вырезом, в стиле ретро рок-тур, летняя в стиле хип-хоп;961;4.7;520;top;
188;Футболка мужская Gildan из хлопка с круглым вырезом и короткими рукавами, цвета в ассортименте, размеры XS-2XL;841;4.7;2031;;
328;Футболка мужская Gsm хлопка;474;4.6;468;;
161;Футболка с изображением медведя;807;4.9;2321;;
13;Футболка мужская YiRuiSen с коротким рукавом;1371;5.0;166;;
36;Мужская футболка 3D Время на рыбалке;1025;4.9;164;top;
29;Мужской пуловер TACVASEN с длинным рукавом, воротником-стойкой и защитой от солнца UPF 50+, цвет в ассортименте;1394;4.9;165;top;
172;Мужская футболка с коротким рукавом, круглым вырезом и принтом;481;4.0;2195;top;
144;Футболка мужская летняя с принтом, 100% хлопок, размер M-4XL, цвет в ассортименте;1309;4.9;2553;top;
238;Футболка мужская удлиненная;741;4.7;522;;
498;Мужская футболка с принтом The Law Version 2;917;4.8;300;;
518;Мужская футболка с коротким рукавом;1105;4.6;294;top;
582;Мужская футболка с короткими рукавами в свободном стиле, цвета в ассортименте, размеры M-5XL;1049;4.8;298;top;
223;Мужская футболка в стиле хип-хоп;735;4.5;540;;
593;Мужская водолазка IEFB с коротким рукавом;1775;4.9;294;;
97;Мужская футболка 3D SALLY FACE - Ларри;1025;4.9;157;top;
53;Мужская хлопковая футболка с длинным рукавом и вафельным принтом;2462;4.7;163;top;
242;Футболка мужская с коротким рукавом и принтом черепашек, 100% хлопок;521;4.8;521;top;
526;Мужская хлопковая футболка с коротким рукавом;1712;4.7;297;;
353;Хлопковая забавная мужская футболка с графическим принтом;1246;4.8;449;top;
534;Мужская футболка с принтом Hunter Killua Zoldyck;378;4.5;294;;
180;Футболка мужская однотонная хлопковая с принтом;875;4.9;2090;;
462;Футболка Bungou бродячие собаки;902;4.9;309;top;
544;Мужская футболка с капюшоном;811;4.6;298;;
43;Футболка мужская однотонная;1227;5.0;163;;
574;Мужская футболка с принтом Hunter Killua Zoldyck;378;4.5;294;;
540;Футболка мужская;1345;4.2;293;;
208;Футболка мужская;1267;4.7;1707;;
394;Мужская летняя футболка с коротким рукавом;2033;4.8;420;;
284;Футболка мужская с круглым вырезом и длинными рукавами в стиле оверсайз, цвета в ассортименте, размеры M-2XL;1338;4.6;488;top;
360;Футболка с 3D-принтом медведя;284;4.8;444;;
399;Мужская футболка оверсайз с круглым вырезом и аниме принтом;878;4.3;414;;
256;Мужская футболка с принтом капибары, хлопок/полиэстер, размер XS-XXL, цвет белый, принт в ассортименте;464;4.5;512;;
519;Мужская футболка в готическом стиле;1222;4.7;294;;
219;Футболка мужская;1060;4.6;1645;;
5;Мужская футболка INCERUN с высоким воротником;1108;4.7;166;top;
551;Футболка мужская однотонная с длинным рукавом;1601;4.8;295;;
100;Мужская футболка из хлопка;2143;4.8;157;;
408;Мужская футболка с коротким рукавом;446;4.4;412;;
504;Мужская футболка с капюшоном;811;4.6;298;;
49;Футболка мужская Dorime с принтом;880;4.8;163;;
33;Футболка мужская с коротким рукавом;867;4.0;164;;
202;Спортивная футболка с коротким рукавом;261;4.7;1800;;
136;Футболка из лайкры с коротким рукавом, мужская, с круглым вырезом, облегающая, однотонная, цвет черный, материал полиэстер;476;4.6;2762;;
28;Мужская футболка KYKU, черная футболка с 3D-принтом в виде животных, лето 2018;279;4.2;165;;
542;Мужская футболка с короткими рукавами в свободном стиле, цвета в ассортименте, размеры M-5XL;1049;4.8;298;top;
232;Футболка камуфляжная для мужчин и женщин;481;4.6;527;;
491;Футболка мужская с длинным рукавом;1922;4.9;302;top;
380;Мужская футболка BINYUXD с коротким рукавом;769;5.0;432;;
290;Мужская хлопковая футболка оверсайз с принтом, размеры S-XL, цвета в ассортименте;1937;4.9;485;top;
420;Мужская однотонная футболка с длинным рукавом;1562;4.9;407;top;
393;Мужская футболка с круглым вырезом, цвет в ассортименте;1308;4.5;421;;
500;Мужская спортивная футболка из хлопка;910;4.6;298;;
140;Футболка мужская TFETTERS свободная;1294;4.7;2589;;
64;Мужская однотонная футболка с длинным рукавом, цвет в ассортименте;997;4.4;162;;
473;Футболка хлопковая с принтом;806;4.3;306;;
130;Мужская спортивная футболка с коротким рукавом;891;4.6;2869;;
604;Мужская футболка с капюшоном;811;4.6;298;;
522;Мужская футболка с короткими рукавами в свободном стиле, цвета в ассортименте, размеры M-5XL;1049;4.8;298;top;
66;Женская футболка оверсайз в стиле Харадзюку;481;4.4;161;top;
15;Мужская промытая хлопковая Футболка ZODF 2024 года, однотонная Свободная Повседневная Базовая Удобная футболка унисекс, брендовая футболка HY0254;1502;4.9;165;top;
158;Футболка мужская GILDAN;857;4.8;2378;;
42;Сетчатая мужская футболка;915;4.4;163;;
494;Мужская футболка с круглым вырезом;387;4.2;301;;
381;Футболка мужская;738;4.9;432;;
189;Мужская приталенная футболка с длинным рукавом, с капюшоном;1027;4.2;1957;;
218;Мужская футболка с принтом дракона;480;5.0;1660;;
54;Футболка с принтом в стиле хип-хоп;734;4.9;163;;
339;Футболка с коротким рукавом и принтом тигра;279;4.5;456;;
297;Футболка мужская Privathinker;840;4.9;484;;
253;Мужская футболка оверсайз с коротким рукавом;922;4.6;514;;
463;"Футболка с коротким рукавом с рисунком аниме ""Эксперименты Лейна""";806;4.7;308;;
457;Футболка с 3D-принтом, цвет в ассортименте;458;4.1;311;;
618;Мужская футболка с коротким рукавом;1105;4.6;294;top;
271;Мужская футболка с длинным рукавом, однотонная Повседневная флисовая футболка с длинным рукавом и круглым вырезом, в Корейском стиле, в стиле Харадзюку, весна 2024;1386;4.6;498;;
203;Мужская камуфляжная футболка с длинным рукавом;1951;4.9;1778;;
163;Мужская шерстяная футболка с отверстиями для большого пальца и манжетами, с длинным рукавом, с Боковым Разрезом;1188;5.0;2301;;
403;Мужская хлопковая футболка с коротким рукавом;950;4.9;412;;
478;Футболка мужская оверсайз в винтажном стиле;218;4.7;305;;
107;Мужская однотонная футболка свободного покроя с круглым вырезом;399;4.0;157;;
391;Круглый вырез;723;4.7;421;;
2;Футболка для мужчин с принтом в ассортименте;442;4.6;167;top;
578;Мужская футболка с коротким рукавом;1105;4.6;294;top;
563;Футболка с логотипом из России;746;4.9;298;;
82;"Мужская футболка с коротким рукавом и принтом из фильма ""Бойцовский клуб"", хлопок/вискоза, размер XS-XXXL, цвет черный";626;4.9;160;top;
207;Футболка мужская оверсайз из 100% хлопка, с коротким рукавом, различные цвета;1826;5.0;1714;;
35;Футболка мужская свободного покроя с забавным принтом;928;4.9;164;;
510;Футболка с коротким рукавом и надписью REM Adventure, хлопок;846;4.6;295;;
429;"Мужская футболка в стиле ""Теория большого взрыва"" Schrodinger's Cat";487;4.2;319;;
456;Мужская футболка 3D Сергей - банка сгущенки;1025;4.8;310;top;
368;COOLMIND MO0118A с круглым вырезом;811;4.9;440;;
93;Футболка мужская с японским аниме «атака на Титанов»;464;4.6;158;;
341;Мужская футболка с коротким рукавом, круглым вырезом и принтом, S-XL, черный/белый;769;4.7;460;top;
566;Мужская хлопковая футболка с коротким рукавом;1712;4.7;297;;
347;Футболка мужская с рисунком японского волейбола и аниме;464;4.6;451;;
243;Футболка мужская с принтом;1346;4.9;521;top;
14;Мужская хлопковая футболка с круглым вырезом;2044;5.0;166;;
317;Футболка Kanpa мужская с графическим рисунком, свободная тенниска большого размера, 100% хлопок, размеры 6xl 5xl;1635;4.9;466;;
389;Мужская футболка с принтом героев сериала Офис;578;4.7;427;top;
275;Футболка мужская оверсайз с принтом;837;4.7;497;top;
168;Мужская хлопковая футболка с рукавом реглан и круглым вырезом, 3 цвета на выбор;1260;4.8;2253;top;
615;Футболка унисекс Harajuku;2001;4.9;294;;
486;2023 Мужская хип-хоп Уличный сверхразмерный футболка с электрошоком Мужская футболка с буквенным принтом летняя хлопковая футболка с коротким рукавом Harajuku;2010;5.0;302;;
606;Мужская хлопковая футболка с коротким рукавом;1712;4.7;297;;
506;Мужская хлопковая футболка с коротким рукавом;1712;4.7;297;;
245;Футболка мужская хлопковая с принтом медведя Тедди;917;4.7;519;top;
568;Мужская летняя футболка с 3D-принтом;293;4.6;296;;
564;Мужская футболка с капюшоном;811;4.6;298;;
191;Мужская футболка Neploha, классическая американская ретро, с минеральным рисунком, различные цвета;973;4.7;1945;;
477;Мужская джинсовая футболка с коротким рукавом;1614;4.5;304;;
512;Мужская однотонная рубашка с коротким рукавом из хлопка и льна, цвета в ассортименте;365;4.4;295;top;
60;Мужская футболка с коротким рукавом и круглым вырезом;945;4.6;162;;
476;Мужские футболки MRMT;450;4.1;304;;
562;Мужская футболка с короткими рукавами в свободном стиле, цвета в ассортименте, размеры M-5XL;1049;4.8;298;top;
254;Футболка с коротким рукавом, круглым вырезом и принтом тай-дай;577;4.4;512;top;
22;Мужская футболка с коротким рукавом;967;4.5;165;;
315;Мужская футболка с круглым вырезом, цвет в ассортименте;865;4.2;466;;
461;Футболка мужская с принтом в стиле хип-хоп, уличная одежда с принтом смешного сердца, монстра, топ с коротким рукавом в стиле Харадзюку, хлопковая Повседневная рубашка;1783;4.8;309;top;
162;Футболка мужская с круглым вырезом и короткими рукавами, 3D-принты в ассортименте, размеры XXS-6XL;293;4.7;2316;;
278;Мужская свободная футболка с длинным рукавом, хлопок/полиэстер, размер S-XXXL, цвет в ассортименте;1532;4.7;495;top;
193;Футболка мужская с коротким рукавом KYKU;280;4.6;1932;;
387;Спортивная футболка с коротким рукавом и принтом;838;4.5;427;;
415;Мужская футболка с надписью СССР и огненным принтом, 7 цветов;261;4.5;407;;
493;Футболка с принтом аниме Моя геройская Академия;464;4.3;301;;
345;Футболка с изображением персонажей Jojo's Bizarre Adventure;464;4.5;453;;
310;Мужская льняная футболка с коротким рукавом;2005;4.7;471;;
132;Футболка мужская;635;4.6;2831;top;
101;Мужская футболка с принтом;1774;4.9;157;;
374;Мужская тактическая быстросохнущая футболка TACVASEN с длинным рукавом и горловиной на молнии, цвет на выбор;1421;4.8;438;top;
