id;name;price;rate;sold;tags;
89;Футболка Мужская/женская с принтом кактуса и Джека, модная Свободная рубашка с принтом Рокки, модный тренд в стиле хип-хоп, с коротким рукавом;915;4.6;159;;
460;Мужская футболка в морском стиле;1419;4.7;309;;
332;Быстросохнущая футболка с длинным рукавом, Мужская Осенняя уличная камуфляжная футболка с круглым вырезом для велоспорта, бега, фитнеса, альпинизма, велосипеда;990;4.6;459;;
216;Мужские хлопковые футболки;789;4.9;1664;;
468;Футболка Hunter X Hunter;477;4.2;307;;
123;Мужская футболка оверсайз с 3D-принтом, спандекс/полиэстер, размер XXS-6XL, принт в ассортименте;479;4.3;3115;;
21;Футболка программиста, цвет в ассортименте;927;4.8;165;;
73;Мужская футболка с коротким рукавом в стиле хип-хоп, черная/белая;473;4.3;161;;
108;Быстросохнущая Спортивная футболка для мужчин Коллекция 2024 года Летние повседневные белые футболки с короткими рукавами Большие размеры 6XL 7XL 8XL 9XL Футболка для спортзала одежда;954;4.9;156;;
272;Мужская футболка с принтом Lil Peep Love Will Tear Us Apart;577;4.6;498;top;
437;Футболка с коротким рукавом и аниме принтом Haikyuu;673;4.7;317;;
104;Футболка мужская спортивная Muscleguys;957;4.8;156;;
