id;name;price;rate;sold;tags;
118;Мужская хлопковая футболка с изображением французского бульдога;877;4.7;155;;
91;Мужская хлопковая футболка с коротким рукавом и воротником «Генри»;1183;4.6;158;;
184;Футболка INFLATION унисекс с круглым вырезом и короткими рукавами, цвета в ассортименте, размеры S-2XL;1443;4.9;2060;;
497;Мужская спортивная футболка с коротким рукавом и принтом;923;4.1;300;;
413;Футболка мужская с коротким рукавом;1010;4.6;408;;
19;Футболка мужская хлопковая с принтом «Пабло»;907;4.6;165;;
430;Мужская футболка с круглым вырезом;1202;4.4;319;;
537;Футболка мужская BINYUXD с длинным рукавом;862;4.9;294;;
146;Футболка оверсайз в полоску, хлопок/полиэстер, размеры S-3XL, 2 расцветки;1417;4.8;2523;top;
304;Футболка с принтом Harajuku;1712;4.9;473;top;
586;Мужская хлопковая футболка с коротким рукавом;1712;4.7;297;;
559;Мужская футболка в готическом стиле;1222;4.7;294;;
427;Футболка мужская компрессионная с 3D-принтом;1675;5.0;320;;
274;Футболка Y2k с японским аниме, крутая футболка с графическим рисунком, футболка с рисунком манга в стиле Харадзюку, повседневный Топ, футболка в готическом стиле;472;4.7;500;top;
263;Мужская футболка с изображением Хасбуллы Магомедова, цвета в ассортименте;866;4.5;506;;
364;Футболка мужская с принтом СССР;472;4.3;441;;
431;Мужская футболка с коротким рукавом;1154;4.5;319;;
169;Мужская тактическая камуфляжная спортивная футболка ZOGAA, размер S-XXXL, цвет черный/серый/болотный;1009;4.5;2241;top;
56;Мужская летняя футболка с длинным рукавом;1096;4.8;162;;
443;Хлопковая мужская футболка с принтом медведя;1914;5.0;315;;
48;Мужская футболка с принтом;738;4.8;163;;
95;Мужская готическая футболка с длинным рукавом Anime;2510;4.5;158;;
306;Мужская футболка с логотипом Ccm;835;4.8;472;;
110;Новое поступление 2021, Мужская модная дизайнерская футболка с сердцем и покером, Забавные футболки в стиле Харадзюку, хипстерские крутые топы с круглым вырезом;751;5.0;156;;
294;Футболка мужская однотонная, 100% хлопок, с короткими рукавами, уличная футболка;645;4.9;486;top;
197;Женская футболка оверсайз с коротким рукавом и круглым вырезом, размер XS-XXXL;481;4.2;1918;top;
620;Футболка мужская;1345;4.2;293;;
469;Футболка с длинным рукавом и принтом волка в стиле хип-хоп;723;4.9;307;;
372;Мужская футболка с круглым вырезом из хлопка;1094;4.6;439;;
409;Мужские футболки с черепами из спандекса и полиэстера в ассортименте;288;4.2;411;;
8;Футболка мужская спортивная, хлопок, цвет в ассортименте;952;4.9;168;top;
414;Мужская футболка TACVASEN из полиэстера с защитой от УФ-лучей, цвета в ассортименте, размеры S-3XL;1137;4.8;409;;
425;Мужская хлопковая футболка с надписью;1076;4.8;320;;
286;Мужская хлопковая футболка с эффектом потертости;2039;4.9;488;top;
277;BROWON, летняя мода 2024, мужские футболки, летняя хлопковая футболка для мужчин, короткий рукав, отложной воротник, корейский стиль, мужская футболка;1267;4.5;493;;
584;Мужская футболка с капюшоном;811;4.6;298;;
71;Футболка мужская компрессионная с длинным рукавом и 3D-принтом;669;4.4;161;;
266;Футболка мужская Liseaven;1308;4.7;504;;
434;Футболка мужская с принтом листьев AIOPESON;1096;4.8;318;;
300;Футболка с принтом китайского дракона;960;4.7;476;;
251;"Мужская футболка с коротким рукавом и принтом ""Кот повар"", хлопок, размер S-XXXL, цвет в ассортименте";1052;4.6;517;top;
575;Футболка унисекс Harajuku;2001;4.9;294;;
276;Футболка мужская с глубоким V-образным вырезом;876;4.3;494;;
151;Хлопковая футболка с японским аниме принтом;746;4.8;2424;;
126;Мужская футболка с круглым вырезом, цвет в ассортименте;1312;4.5;3057;;
610;Футболка с коротким рукавом и надписью REM Adventure, хлопок;846;4.6;295;;
532;Мужская однотонная рубашка с коротким рукавом из хлопка и льна, цвета в ассортименте;365;4.4;295;top;
187;Футболка LAPPSTER мужская оверсайз, 100% хлопок, цвет и размер в ассортименте;866;4.8;2038;top;
335;"Мужская футболка коротким рукавом и принтом ""Пчелы"", полиэстер/спандекс, размер XXS-6XL, принт в ассортименте";480;4.0;457;;
314;Футболка унисекс, с принтом Genshin Impact, 2021;464;4.6;468;;
479;Яркий звуковой активный эквалайзер, футболка, светодиодная футболка с подсветкой вверх и вниз, светодиодная футболка с активацией музыки;1212;4.5;305;;
312;Футболка мужская с круглым вырезом и короткими рукавами, принты в ассортименте, размеры S-6XL;196;4.1;472;top;
612;Мужская однотонная рубашка с коротким рукавом из хлопка и льна, цвета в ассортименте;365;4.4;295;top;
32;Футболка мужская;952;4.8;164;;
589;Мужская футболка с длинными рукавами в свободном стиле, цвета и принты в ассортименте, размеры S-5XL;664;4.4;296;;
508;Мужская летняя футболка с 3D-принтом;293;4.6;296;;
571;Футболка мужская однотонная с длинным рукавом;1601;4.8;295;;
488;Футболка с 3D принтом;1195;4.9;302;;
143;Футболка мужская GustomerD с коротким рукавом;943;4.9;2555;;
20;Футболка программиста, цвет в ассортименте;927;4.8;165;;
174;Свитшот с принтом;1442;5.0;2140;;
485;Женская футболка BIQUINI с короткими рукавами в свободном стиле, цвета в ассортименте, размеры XS-3XL;773;4.5;302;top;
484;Хлопковая мужская футболка;762;4.7;302;;
26;Мужская футболка с коротким рукавом и принтом в ассортименте;908;4.8;165;;
448;Футболка мужская японская Shotokan Karate Bujinkan Dojo Pro;905;4.7;312;;
592;Мужская однотонная рубашка с коротким рукавом из хлопка и льна, цвета в ассортименте;365;4.4;295;top;
608;Мужская летняя футболка с 3D-принтом;293;4.6;296;;
320;Футболка с узором в стиле граффити;260;4.6;464;;
247;Камуфляжная мужская футболка;1091;4.8;518;;
340;Винтажная мужская футболка из хлопка;1497;4.8;455;;
156;Футболки унисекс летние с коротким рукавом и забавным принтом;898;4.5;2386;;
128;Футболка с коротким рукавом и принтом собаки;899;4.8;3009;;
369;Мужские футболки, повседневные футболки с коротким рукавом, лето 2023, модная одежда, высококачественные хлопковые футболки с принтом для мужчин, одежда;871;4.5;440;top;
115;Футболка унисекс в стиле кэжуал с изображением ковбоя;751;4.7;155;;
175;Футболка мужская базовая, мягкая эластичная, с коротким рукавом, белая, на лето;481;4.5;2143;top;
59;Мужские летние короткие футболки;2621;4.8;163;;
346;Футболка мужская хлопковая летняя черная с надписями;1076;4.9;452;;
224;Футболка мужская с принтом;1131;4.8;540;;
18;Футболка мужская и женская с круглым вырезом и коротким рукавом;665;4.8;165;;
322;Мужская однотонная футболка с коротким рукавом;1457;4.8;463;;
257;Быстросохнущая камуфляжная футболка с круглым вырезом и короткими рукавами;479;4.9;512;;
329;Футболка мужская/женская с 3D-принтом травы;481;4.7;460;;
594;Мужская футболка с принтом Hunter Killua Zoldyck;378;4.5;294;;
192;Мужские хлопковые футболки с принтом персонажа манги;962;4.9;1945;top;
343;Мужская футболка с коротким рукавом;639;4.2;453;;
545;Мужская футболка в стиле хип-хоп, размеры M - 5XL, цвет в ассортименте;954;4.5;299;top;
293;Футболка мужская оверсайз;1659;4.9;483;;
96;Футболка для мужчин Farthestsailing, размер S - 6XL, цвет в ассортименте;919;4.5;157;;
182;Мужская футболка в полоску в стиле оверсайз, хлопок, размер S-XXXL;864;4.8;2081;top;
397;Женская футболка в стиле Харадзюку Y2k;481;4.1;416;;
356;Футболка мужская CCM с коротким рукавом;952;4.5;447;;
552;Мужская однотонная рубашка с коротким рукавом из хлопка и льна, цвета в ассортименте;365;4.4;295;top;
336;Футболка хлопковая с коротким рукавом, белая, с надписью I'm Fine;1308;4.4;457;;
6;Мужская футболка с круглым вырезом, хлопок;521;5.0;166;;
47;Футболка Genshin Impact мужская;455;4.7;163;;
577;Футболка мужская BINYUXD с длинным рукавом;862;4.9;294;;
418;Футболка мужская с рисунком котика в пакете, 22 цвета;785;4.7;411;;
527;Футболка мужская оверсайз из хлопка;880;5.0;303;;
17;Футболка унисекс Harajuku;2038;4.9;165;;
50;Мужская футболка с коротким рукавом и аниме принтом, цвет в ассортименте;929;4.9;165;top;
600;Футболка мужская;1345;4.2;293;;
573;Мужская водолазка IEFB с коротким рукавом;1775;4.9;294;;
4;Мужская хлопковая свободная футболка с принтом собаки;785;4.6;166;;
351;Мужские футболки 3D с изображением плоскостного участка пальмы, Лакросс, косплей, маскарадный костюм, для девушек;539;4.9;455;;
557;Футболка мужская BINYUXD с длинным рукавом;862;4.9;294;;
471;Футболка с коротким рукавом в стиле Харадзюку;751;5.0;306;;
390;Мужская футболка 3D Manga;1025;4.8;422;top;
466;Мужская футболка с коротким рукавом, с капюшоном и графическим принтом;1498;4.4;309;top;
396;Льняная хлопковая футболка с рукавом до локтя для мужчин;1350;4.6;417;top;
227;Футболка мужская быстросохнущая с коротким рукавом и принтом;1117;4.4;529;top;
27;Мужская футболка AIOPESON с круглым вырезом;1303;4.7;166;;
569;Мужская футболка с длинными рукавами в свободном стиле, цвета и принты в ассортименте, размеры S-5XL;664;4.4;296;;
265;Мужская футболка с принтом банана;781;4.4;504;;
52;Мужская футболка хлопок Билли Херрингтон Великий / Billy Herrington / гачи / Гачимучи;1170;4.8;163;;
231;Мужская футболка с принтом Genshin Impact Kawaii Hu Tao Graphic, футболка Xiao kaedeхара Kazuha, футболка унисекс в стиле хип-хоп, Мужская футболка в стиле Харадзюку;464;4.5;528;;
39;Мужская хлопковая футболка с длинным рукавом;1115;4.4;163;;
159;Плотная хлопковая однотонная футболка унисекс, цвета в ассортименте;913;4.8;2370;;
239;Футболка унисекс Harajuku;1712;5.0;522;;
595;Футболка унисекс Harajuku;2001;4.9;294;;
177;Футболка мужская с коротким рукавом с ярким 3D-принтом;482;4.4;2131;;
521;Свитшот с коротким рукавом GONTHWID из хлопка;1620;4.7;293;;
438;Женская футболка с коротким рукавом и принтом медведя;481;4.1;317;;
196;Брендовая мужская футболка s muscle, для бодибилдинга, для фитнеса, мужские топы, хлопковые майки, плюс футболка больших размеров, хлопковая Сетчатая футболка с коротким рукавом;920;4.5;1918;;
523;Футболка с логотипом из России;746;4.9;298;;
385;Японская мужская толстовка с принтом;1240;4.7;428;;
599;Мужская футболка в готическом стиле;1222;4.7;294;;
529;Мужская футболка с длинными рукавами в свободном стиле, цвета и принты в ассортименте, размеры S-5XL;664;4.4;296;;
69;Футболки унисекс;549;4.4;161;;
416;Футболка мужская оверсайз в стиле Харадзюку;876;4.5;407;;
170;Мужская футболка с коротким рукавом;769;4.6;2224;;
502;Мужская футболка с короткими рукавами в свободном стиле, цвета в ассортименте, размеры M-5XL;1049;4.8;298;top;
164;MRMT 2023 новая хлопковая Мужская футболка с коротким рукавом, Мужская футболка с коротким рукавом, однотонные мужские футболки для мужчин, топы, футболки;539;4.9;2290;top;
311;Футболка мужская хлопковая однотонная с круглым вырезом, цвета и размеры в ассортименте;977;4.9;472;;
195;Мужская футболка с круглым вырезом, коротким рукавом и принтом дерева;769;4.8;1920;;
154;Футболка мужская оверсайз из двух предметов;1134;4.6;2398;;
352;Мужские футболки из чесаного хлопка, 6,7 унции, г;1140;4.9;449;top;
362;Мужская хлопковая футболка с коротким рукавом и принтом в ассортименте;908;4.7;443;;
228;Футболка мужская компрессионная с коротким рукавом;289;4.5;529;;
358;Мужская футболка с рождественским принтом, размеры XXS - 6XL, цвет в ассортименте;480;4.4;445;;
105;Футболка мужская MRMT;673;4.4;156;;
421;Футболка мужская ARCSINX;1903;4.9;402;;
76;Футболка с принтом Джек Расселла;686;4.9;162;;
453;Футболка Foxhole Court MINYARD 03 JOSTEN PALMETTD, летняя Мужская/женская уличная футболка, уличная одежда, Бейсбольная женская футболка;952;4.9;312;;
598;Мужская футболка с коротким рукавом;1105;4.6;294;top;
121;Свитшот с коротким рукавом GONTHWID из хлопка;1620;4.7;293;;
417;Мужские футболки с коротким рукавом;922;4.8;407;;
440;Мужская спортивная одежда в стиле хип-хоп;1162;4.8;317;;
583;Футболка с логотипом из России;746;4.9;298;;
209;Футболка хлопковая с принтом;1821;4.9;1692;top;
359;Мужская футболка хлопок Гуси;1260;4.7;445;top;
528;Мужская летняя футболка с 3D-принтом;293;4.6;296;;
367;Футболка мужская с длинным рукавом;1011;4.6;440;;
435;Мужская хлопковая повседневная футболка с коротким рукавом;1907;4.9;319;;
9;Новая повседневная полосатая футболка TFETTERS 2023, Мужская футболка с длинным рукавом для фитнеса, Мужская одежда, футболки, мужская футболка;1254;4.9;166;;
406;Футболка мужская с забавным AOT Cat on Titan, Повседневная белая рубашка с коротким рукавом, уличная одежда унисекс с рисунком аниме «атака на Мяу»;741;4.6;412;;
38;Винтажная женская футболка с коротким рукавом;973;4.9;163;;
141;Футболка унисекс с длинным рукавом, свободная, размер S-5XL, цвет и дизайн принта в ассортименте;1243;4.6;2588;;
255;Хлопковая однотонная мужская футболка с коротким рукавом, модный бренд, трендовые свободные половинчатые белые черные футболки, оптовая продажа одежды на Хэллоуин;969;4.9;512;;
305;Футболка мужская оверсайз из натурального хлопка, с открытыми плечами;633;4.6;481;;
530;Футболка с коротким рукавом и надписью REM Adventure, хлопок;846;4.6;295;;
61;Футболка мужская японская аниме;463;4.3;162;;
113;Уличная футболка в стиле хип-хоп, 2023 Мужская Эстетическая футболка с изображением сердца, летняя хлопковая футболка с короткими рукавами, футболки;1935;5.0;155;;
503;Футболка с логотипом из России;746;4.9;298;;
560;Футболка мужская;1345;4.2;293;;
382;Футболка мужская;1115;4.6;431;;
264;Футболка мужская TEEHUB с коротким рукавом;793;4.4;505;;
517;Футболка мужская BINYUXD с длинным рукавом;862;4.9;294;;
299;Новое поступление 2019, дизайнерская мужская модная футболка Happy Cat, классные топы, хипстерские футболки с коротким рукавом T219;793;5.0;477;;
152;COODRONY Мужская футболка с короткими рукавами и воротником мандарин, весна-лето 2020, новый топ, Мужская брендовая одежда, облегающие хлопковые футболки S7645;1417;4.7;2421;;
268;Мужская футболка-поло Burzum с коротким рукавом;1226;4.6;499;;
536;Мужская футболка с коротким рукавом и принтом кунг-фу;1539;5.0;294;;
361;Футболка с коротким рукавом и принтом Burgerzilla Harajuku, цвет в ассортименте;1052;4.5;444;;
548;Мужская летняя футболка с 3D-принтом;293;4.6;296;;
40;Летняя женская мужская футболка Sealoon, новая модная футболка с принтом моря в воздушном шаре, Забавные топы с коротким рукавом;793;4.0;163;;
516;Мужская футболка с коротким рукавом и принтом кунг-фу;1539;5.0;294;;
309;Футболка мужская из натурального хлопка;893;4.8;470;top;
200;Мужские компрессионные дышащие быстросохнущие футболки с длинным рукавом;961;4.9;1810;;
499;Мужская футболка с круглым вырезом;1053;4.5;300;;
383;Камуфляжная мужская и женская футболка, цвета и размеры в ассортименте;792;5.0;429;;
148;Футболка мужская с V-образным вырезом, хлопок, повседневная, для фитнеса и бодибилдинга, на молнии, с коротким рукавом;830;4.4;2491;;
505;Мужская футболка в стиле хип-хоп, размеры M - 5XL, цвет в ассортименте;954;4.5;299;top;
550;Футболка с коротким рукавом и надписью REM Adventure, хлопок;846;4.6;295;;
149;Футболка мужская с круглым вырезом и короткими рукавами, принты 3D в ассортименте, размеры S-5XL;232;4.4;2459;;
451;Футболка с принтом GONTHWID в стиле хип-хоп;1800;4.3;311;;
350;Мужские футболки с длинным рукавом;687;4.2;449;;
327;Футболка мужская с рисунком японского аниме Hunter X Hunter;464;4.2;460;;
422;Повседневная свободная футболка оверсайз с коротким рукавом и принтом мишки;481;4.2;320;;
125;Футболка с коротким рукавом и принтом, цвет в ассортименте;793;4.5;3087;;
538;Мужская футболка с коротким рукавом;1105;4.6;294;top;
98;Мужская хлопковая футболка с принтом в стиле хип-хоп;2038;4.8;157;top;
145;Хип-хоп свободные мужские уличные футболки Повседневные Классические 2024 летние с короткими рукавами Черно-белые футболки больших размеров 5XL 6XL;1154;4.5;2543;top;
241;Футболка мужская KYKU, летняя футболка с цветным 3D-принтом долларов, одежда в стиле хип-хоп;264;4.5;522;;
405;Футболка мужская с круглым вырезом и короткими рукавами, цвета в ассортименте, размеры XS-XL;385;4.8;412;top;
99;Футболка мужская из хлопка и льна с V-образным вырезом;874;4.4;157;;
373;Футболка для мужчин и женщин, однотонная с цветной отстрочкой, хлопок;1189;4.9;439;top;
326;Новинка 2024, Мужская модная летняя футболка с коротким рукавом и принтом льва, Забавные футболки, хипстерские Популярные топы с круглым вырезом;813;5.0;461;;
281;Мужская футболка с принтом льва;325;4.9;492;;
295;Футболка женская летняя, с коротким рукавом, в стиле панк;208;4.3;478;;
590;Футболка с коротким рукавом и надписью REM Adventure, хлопок;846;4.6;295;;
124;Мужские футболки с принтом;596;4.7;3105;;
