id;name;price;rate;sold;tags;
51;Мужская футболка с коротким рукавом и надписью, цвет в ассортименте;831;5.0;163;;
585;Мужская футболка в стиле хип-хоп, размеры M - 5XL, цвет в ассортименте;954;4.5;299;top;
84;Мужская футболка с длинным рукавом и принтом тигра;723;4.3;159;;
307;SIMWOOD 2022 Весна Лето Новые свободные 300 г тяжеловесная ткань футболки мужские 100% хлопок Логотип Вышивка Топы Высокое качество тройники;1346;5.0;471;top;
111;Черная футболка с коротким рукавом, круглым вырезом и принтом молнии, S-XL;1275;4.6;155;;
609;Мужская футболка с длинными рукавами в свободном стиле, цвета и принты в ассортименте, размеры S-5XL;664;4.4;296;;
270;Мужская футболка хлопок PornHub;1260;4.7;498;top;
355;Мужская футболка с коротким рукавом и круглым вырезом;876;4.8;448;top;
330;Мужская футболка хлопок MICHAEL JORDAN (НА СПИНЕ);1260;4.6;460;top;
535;Футболка унисекс Harajuku;2001;4.9;294;;
283;Летние Новые базовые футболки в стиле Хай-стрит, стиль хип-хоп, качественная спортивная футболка оверсайз из 100% хлопка для мужчин и женщин;1873;4.7;490;top;
489;Разборчивые 2023 летние большие хлопковые футболки мужские однотонные уличные мужские свободные повседневные футболки с коротким рукавом футболки мужские;1030;4.8;302;;
236;Футболка с принтом My Chemical;785;4.8;523;;
133;Мужская однотонная футболка с длинным рукавом;1183;4.2;2805;;
3;Мужская футболка с принтом;965;4.8;167;;
229;Мужская хлопковая футболка с коротким рукавом и принтом;1587;4.0;529;;
579;Мужская футболка в готическом стиле;1222;4.7;294;;
428;Мужская байкерская футболка с ретро принтом, размеры XXS-6XL, рисунок в ассортименте;217;4.6;319;;
186;Мужские черные хлопковые футболки со зловещими принтами в ассортименте;1505;4.8;2055;top;
400;Футболка мужская, хлопковая, с коротким рукавом, в стиле хип-хоп;1620;4.7;413;;
376;Футболка GONTHWID в полоску для мужчин и женщин, повседневная хлопковая рубашка в стиле Харадзюку, топ с коротким рукавом, черный красный розовый цвет, лето;1416;5.0;434;;
80;Мужская футболка из хлопка;963;4.9;160;top;
249;Футболка мужская Ouma Kokichi Danganronpa V3;464;4.6;517;top;
57;Универсальная эластичная мужская футболка с круглым вырезом;1476;4.5;162;;
222;Футболка мужская летняя, с вышивкой и планетами, в стиле Харадзюку;1794;4.2;541;;
525;Мужская футболка в стиле хип-хоп, размеры M - 5XL, цвет в ассортименте;954;4.5;299;top;
250;Футболка GILDAN мужская с круглым вырезом, Облегающая рубашка с короткими рукавами, Топ базовая, брендовая одежда, однотонная, размера плюс, на лето;834;4.9;517;;
384;Хлопковая мужская футболка COLMIND QI0237A с коротким рукавом;811;4.6;428;top;
501;Мужская футболка Aderventure с коротким рукавом в виде животных;793;4.7;298;;
554;Мужская футболка с принтом Hunter Killua Zoldyck;378;4.5;294;;
41;Футболка с надписями для влюбленных;871;4.4;163;;
147;Футболка LAPPSTER мужская оверсайз с круглым вырезом в стиле Харадзюку, 100% хлопок, в ассортименте;988;4.8;2509;top;
379;Футболка мужская с забавным музыкальным проигрывателем, свободная хлопковая тенниска с круглым вырезом, майка в стиле хип-хоп, одежда, лето;866;4.8;435;top;
79;Футболка мужская с принтом цепной пилы, кавайная одежда в стиле гранж Харадзюку, мультяшная эстетика японского аниме;464;4.4;160;;
120;Мужская хлопковая футболка с коротким рукавом и надписью Punks Not Dead;908;5.0;154;top;
402;Мужская хлопковая футболка DUNDER MIFFLIN;672;4.7;412;top;
150;Мужская футболка с принтом;2469;4.9;2435;;
333;Футболка для мужчин Acacia Person, размер S - 4XL, цвет в ассортименте;1047;4.8;459;;
134;Мужская футболка оверсайз с принтом Mont March, хлопок, размер S-4XL, цвет серый/черный/белый/синий;1016;4.6;2781;;
217;Футболка с японским аниме канеки Кен Токийский Гуль Мужская классная летняя футболка Повседневная гранж футболка уличная одежда Топ Мужская футболка;471;4.4;1661;;
565;Мужская футболка в стиле хип-хоп, размеры M - 5XL, цвет в ассортименте;954;4.5;299;top;
439;Футболка Yoshitomo Nara dream Мужская, хлопковая тенниска, новая майка, мужские топы;798;4.9;317;;
88;Мужские футболки больших размеров;1923;5.0;158;top;
323;Футболка мужская оверсайз с принтом тигра, размеры XXS - 6XL, цвет в ассортименте;217;4.6;463;;
338;Футболка хлопковая оверсайз с аниме принтом, размеры XS-XXL, цвета в ассортименте;771;4.7;456;;
78;Футболка мужская с рисунком кошки, уличная одежда в стиле хип-хоп, хлопковая рубашка с коротким рукавом и принтом японского каньцзи и животных, белая, на лето;819;4.9;160;;
237;Футболка мужская Fuy Bill;1294;4.8;523;;
487;Мужская футболка с коротким рукавом и 3D-принтом животных;196;4.6;379;top;
279;Футболка мужская с длинным рукавом и V-образным вырезом;219;4.6;494;;
11;Мужская летняя футболка в стиле ретро;1636;4.9;166;;
210;Мужская футболка с 3D-принтом медведя;273;4.7;1692;;
467;Мужская футболка с круглым вырезом;873;4.5;307;;
395;Футболка мужская Kawaii Nagito Komaeda;464;4.6;418;;
348;Мужская футболка 3D Рожденный в СССР;1025;4.8;450;top;
605;Мужская футболка в стиле хип-хоп, размеры M - 5XL, цвет в ассортименте;954;4.5;299;top;
31;Футболка мужская DIMUSI;843;4.9;164;;
576;Мужская футболка с коротким рукавом и принтом кунг-фу;1539;5.0;294;;
206;Футболка мужская свободная с длинным рукавом, двойная в стиле хип-хоп, цвета в ассортименте, размеры S-5XL;939;4.7;1724;top;
313;Футболка мужская;861;4.5;468;;
513;Мужская водолазка IEFB с коротким рукавом;1775;4.9;294;;
142;Футболка унисекс с длинным рукавом, свободная, размер S-5XL, цвет и дизайн принта в ассортименте;1243;4.6;2588;;
475;Футболка мужская оверсайз в стиле хип-хоп;1159;4.6;305;;
580;Футболка мужская;1345;4.2;293;;
58;Футболка с коротким рукавом для мужчин и женщин;980;4.2;162;;
616;Мужская футболка с коротким рукавом и принтом кунг-фу;1539;5.0;294;;
507;Футболка мужская оверсайз из хлопка;880;5.0;303;;
230;Футболка с объемным рисунком для мужчин KYKU;285;4.4;528;;
211;Футболка мужская плиссированная;558;4.2;1689;;
25;Футболка мужская с японским аниме Umibe No Etranger;464;4.6;165;top;
480;Футболка мужская;1644;4.9;303;;
370;Мужская футболка с принтом My Hero Academia Bakugou;471;4.3;440;;
363;Футболка мужская с геометрическим принтом, полиэстер/спандекс, размеры S-6XL, цвета в ассортименте;196;4.5;448;;
365;Мужская хлопковая футболка-поло с коротким рукавом;796;4.4;441;;
470;Мужская футболка, цвет и размер в ассортименте;1442;4.8;306;top;
72;Винтажная хлопковая летняя мужская футболка с надписью LOVE MY SWAG;1337;4.7;161;;
354;Мужская футболка с коротким рукавом;962;4.6;448;;
178;Футболка мужская хлопковая с аниме принтом, размер S-XXL, цвет черный, рисунок в ассортименте;1505;4.8;2128;top;
617;Футболка мужская BINYUXD с длинным рукавом;862;4.9;294;;
62;Футболка с 3D граффити для мальчиков и девочек;279;4.6;162;;
602;Мужская футболка с короткими рукавами в свободном стиле, цвета в ассортименте, размеры M-5XL;1049;4.8;298;top;
103;Мужская хлопковая футболка, модная летняя новая модная футболка с забавной крысой, симпатичная японская мышь, крутая Подарочная футболка для влюбленных;832;4.8;156;top;
205;Футболка с радужным принтом для мужчин и женщин;723;4.6;1724;;
591;Футболка мужская однотонная с длинным рукавом;1601;4.8;295;;
92;Мужская футболка с 3D-принтом тигра;202;4.3;158;;
541;Свитшот с коротким рукавом GONTHWID из хлопка;1620;4.7;293;;
472;Футболка мужская приталенная с длинным рукавом, топ для отдыха и бодибилдинга, рубашка с длинным рукавом, весна-лето;930;4.6;305;top;
570;Футболка с коротким рукавом и надписью REM Adventure, хлопок;846;4.6;295;;
30;Мужская футболка 3D Stalker;990;4.6;164;top;
112;Футболка мужская хлопковая с круглым вырезом и короткими рукавами;532;4.7;155;;
511;Футболка мужская однотонная с длинным рукавом;1601;4.8;295;;
214;Мужская футболка с принтом сакуры;1712;5.0;1677;top;
546;Мужская хлопковая футболка с коротким рукавом;1712;4.7;297;;
324;"Прикольная мужская футболка ""Идеальный мужчина"" Большие размеры до 10XL Мужской подарок";800;4.9;462;top;
291;Мужская футболка с коротким рукавом и логотипом Tom Tailor, размер S - XXXL, цвет в ассортименте;472;4.8;484;top;
531;Футболка мужская однотонная с длинным рукавом;1601;4.8;295;;
464;Футболка мужская с длинным рукавом, цвет в ассортименте;1465;4.6;308;;
454;Мужская хлопковая футболка с логотипом Guns N Roses Bullet;966;4.5;310;top;
157;Футболка мужская хлопковая;838;4.8;2378;top;
83;Мужская хлопковая футболка с коротким рукавом и цифровым принтом Harajuku;1835;5.0;159;;
252;Футболка мужская с длинным рукавом;780;4.6;514;;
597;Футболка мужская BINYUXD с длинным рукавом;862;4.9;294;;
240;Винтажная ретро-футболка с надписью «I Love The Smell of Napalm in The Morning», Билл Килгор Апокалипсис, футболка для мужчин и мальчиков;899;4.8;522;;
407;Мужская футболка с коротким рукавом;2044;4.9;412;top;
65;Футболка с 3d принтом аниме;1052;4.0;161;;
273;Спортивная мужская футболка с принтом;390;4.6;499;top;
74;GAAJ - Европейский размер Футболка на заказ для мужчин и женщин 100% хлопок Вышивка с принтом своими руками Логотип известного дизайнера мужская женская футболка Футболка;1635;4.8;161;;
258;Футболка мужская;480;4.6;512;;
556;Мужская футболка с коротким рукавом и принтом кунг-фу;1539;5.0;294;;
337;Футболка с принтом в виде грибов;684;4.8;456;top;
581;Свитшот с коротким рукавом GONTHWID из хлопка;1620;4.7;293;;
401;Мужская футболка Jeansian с длинным рукавом и защитой от солнца;1250;4.8;413;;
262;BROWON Осенняя Корейская мужская футболка в винтажном стиле в стиле пэчворк черная и серая длинная футболка с круглым вырезом Мужская одежда 2024 размера плюс M-5XL;1371;4.7;509;;
137;Однотонная футболка с коротким рукавом, хлопок, размер M-4XL, цвет в ассортименте;479;4.8;2740;;
342;Мужская футболка с коротким рукавом и трехмерным принтом;446;4.3;454;;
603;Футболка с логотипом из России;746;4.9;298;;
213;Мужская футболка с принтом;464;4.5;1685;;
543;Футболка с логотипом из России;746;4.9;298;;
301;Мужская футболка с круглым вырезом, 3D печать;438;4.5;475;;
482;Футболка мужская приталенная с глубоким V-образным вырезом и коротким рукавом;905;4.6;303;;
7;Футболки унисекс, хлопок;480;4.3;166;;
106;Футболка мужская стразы;2020;4.5;156;;
116;Мужская футболка в стиле ретро с надписью «Французский бульдог»;814;4.9;156;;
160;Мужская рубашка ReFire Gear с длинным рукавом в стиле милитари, 6 цветов на выбор;2172;4.8;2342;;
183;Мужская хлопковая футболка с принтом;2001;4.7;2066;;
533;Мужская водолазка IEFB с коротким рукавом;1775;4.9;294;;
366;Футболки для мужчин и женщин с принтом в ассортименте;624;4.8;441;;
179;Мужская камуфляжная футболка с длинными/короткими рукавами, размеры S - 3XL, цвет в ассортименте;1155;4.7;2098;;
596;Мужская футболка с коротким рукавом и принтом кунг-фу;1539;5.0;294;;
201;Футболка унисекс хлопковая;629;4.8;1803;;
423;Мужская футболка с круглым вырезом, коротким рукавом и принтом;684;4.7;320;;
302;Мужская футболка с коротким рукавом;849;4.6;474;;
410;Мужская футболка из вискозы, с коротким рукавом;481;4.2;413;;
398;Мужская футболка с коротким рукавом;255;4.0;416;;
288;Бренд BROWON, новинка 2024, Стильная хлопковая Мужская футболка, футболка с длинным рукавом для мужчин, однотонная, на молнии, с принтом, с воротником, футболка большого размера;1444;4.7;487;;
259;"Футболка мужская с принтом ""пиво""";481;4.3;511;;
261;BROWON Осенняя Корейская мужская футболка в винтажном стиле в стиле пэчворк черная и серая длинная футболка с круглым вырезом Мужская одежда 2024 размера плюс M-5XL;1371;4.7;509;;
613;Мужская водолазка IEFB с коротким рукавом;1775;4.9;294;;
44;Мужская винтажная футболка из искусственной замши с принтом;2104;4.4;163;top;
75;Мужская футболка в стиле Харадзюку с японским аниме принтом;479;4.5;161;;
539;Мужская футболка в готическом стиле;1222;4.7;294;;
68;Мужская футболка с коротким рукавом;1443;4.9;161;top;
12;Белая мужская футболка с рисунком велосипеда, размер S-XXXL, принты в ассортименте;765;4.6;166;top;
165;Футболка мужская облегающая с V-образным вырезом и коротким рукавом;1046;4.6;2287;;
445;Мужская футболка TACVASEN с коротким рукавом и отложным воротником, цвет на выбор;1772;4.7;313;top;
212;Мужская хлопковая однотонная футболка, размеры М - 5XL, цвет в ассортименте;962;4.8;1690;;
334;Мужская футболка в готическом стиле с принтом;2404;4.6;458;;
85;Мужская футболка с коротким рукавом, V-образным вырезом, размеры до 5XL;1009;4.6;159;;
280;Мужская приталенная футболка с коротким рукавом и круглым вырезом, 6 шт;3437;4.6;492;;
450;Мужская Прозрачная Сексуальная Сетчатая футболка, новинка 2022, прозрачные сетчатые майки с длинным рукавом, вечерние футболки для ночного клуба;1202;4.7;313;;
81;Черная футболка с коротким рукавом PLstar Cosmos Brp Can-am 3dprint;1158;4.6;160;;
24;Футболка с принтом для мужчины, забавная футболка, 2020 Я пережил Большие размеры оверсайз;950;4.7;165;;
289;Футболка мужская с принтом;447;4.8;486;top;
303;Мужская футболка с коротким рукавом;930;4.8;473;;
282;Мужская футболка с принтом в стиле барокко;343;4.1;491;;
246;Мужская футболка с коротким рукавом и принтом из мультфильма Aolamegs;1359;5.0;519;;
292;Футболка с принтом китайского дракона;1616;4.0;483;;
331;Мужская водолазка;1726;4.8;460;;
139;Мужская хлопковая футболка с коротким рукавом и принтом, размер S-XXL;923;4.5;2621;top;
190;Футболка мужская с принтом;472;4.7;1947;;
167;Мужская футболка с рукавами 3/4 в свободном стиле, цвет черный, белый в полоску, размеры S-3XL;1049;4.5;2268;top;
298;SIMWOOD 2023 летняя новая мужская футболка с принтом и круглым вырезом, 100% хлопок, футболка с коротким рукавом, облегающие футболки, модные топы SJ170040;1284;5.0;478;;
10;Хлопковая мужская футболка Jesus Desu;980;4.7;166;;
198;Футболки для мужчин и женщин, однотонные, с круглым вырезом, цвета в ассортименте, размеры M-4XL;479;4.5;1891;;
233;Мужская футболка базовая однотонная хлопковая;1227;4.9;534;top;
321;Футболка с 3D принтом единорога для девочек;246;4.4;463;;
607;Футболка мужская оверсайз из хлопка;880;5.0;303;;
267;Мужская футболка с коротким рукавом;481;4.5;508;;
86;Футболка с круглым вырезом и принтом из аниме «Danganronpa V3: Killing Harmony Oma Kokichi»;902;4.8;158;;
176;Футболка мужская Simwood с круглым вырезом и короткими рукавами, цвета в ассортименте, размеры S-3XL;1137;4.9;2137;top;
549;Мужская футболка с длинными рукавами в свободном стиле, цвета и принты в ассортименте, размеры S-5XL;664;4.4;296;;
220;Мужские футболки из хлопка и полиэстера в военном стиле с российской символикой в ассортименте;289;4.4;1642;;
318;Мужская футболка, Мужская футболка с коротким рукавом, подходящая футболка в клетку, новая деловая одежда, повседневные Модные мужские топы;1346;4.9;465;;
492;Спортивная одежда мужская;1162;4.8;301;;
392;Футболка унисекс SIMWOOD;1250;5.0;421;top;
215;Мужская хлопковая футболка с длинным рукавом;1644;4.9;1674;top;
155;Футболка мужская с длинным рукавом;481;4.3;2391;top;
77;Мужская футболка с защитой от деформации Saucezhan, белая футболка из двухтканого материала, хлопковая Футболка с защитой от усадки, 340 г;2662;5.0;160;top;
94;Спортивная мужская футболка с принтом;1565;4.9;163;top;
432;Футболка мужская с принтом;957;4.4;319;;
70;Футболка мужская с 3D принтом в стиле Харадзюку;481;4.5;161;;
16;Мужская однотонная водолазка с длинным рукавом;715;4.5;165;;
194;Мужские футболки с 3D-принтами из полиэстера в ассортименте;217;4.2;1951;;
377;Мужская хлопковая футболка в стиле Харадзюку;481;4.2;435;;

520;Футболка мужская;1345;4.2;293;;
119;Мужская футболка с коротким рукавом и надписью Never, цвет в ассортименте;738;4.8;154;;
411;Мужская футболка с глубоким V-образным вырезом;622;4.4;409;top;
436;Мужская средневековая туника;577;4.5;318;;
34;Мужская хлопковая футболка с коротким рукавом;1443;4.7;164;;
1;Футболка XIN YI мужская с забавным принтом Луны и астронавта, Повседневная Свободная рубашка из 100% хлопка, с круглым вырезом;649;4.9;167;;
614;Мужская футболка с принтом Hunter Killua Zoldyck;378;4.5;294;;
555;Футболка унисекс Harajuku;2001;4.9;294;;
371;Футболка для мужчин тактическая, размер S - XXXL, цвет в ассортименте;1097;4.3;440;;
357;2023 Мужская уличный сверхразмерный футболка Графический хип-хоп Harajuku футболка хлопок свободный летний короткий рукав Футболка топы тройники черный;1918;4.9;446;top;
455;"Хлопчатобумажная футболка с принтом ""Сверхъестественное""";866;4.8;311;top;
553;Мужская водолазка IEFB с коротким рукавом;1775;4.9;294;;
23;Мужская футболка Zecmos в черно-белую полоску;885;4.7;165;;
474;Футболка мужская jeansian;1250;4.6;305;;
